{
  "$schema": "https://manifests.lumoria.dev/1/schemas/catalog.json",
  "default_installer": "ffxi",
  "runners": [
    "ge-proton",
    "proton-cachyos",
    "wine-kron4ek-staging",
    "wine-kron4ek-proton",
    "wine-ge-custom"
  ],
  "components": [
    "dxvk",
    "d7vk",
    "dxvk-sarek",
    "dxvk-sarek-d7vk",
    "rysas-d7vk",
    "dgvoodoo"
  ],
  "redists": [
    "dotnet48",
    "dotnet7",
    "dotnet8",
    "dotnet9",
    "dotnet10",
    "dotnetdesktop7",
    "dotnetdesktop8",
    "dotnetdesktop9",
    "dotnetdesktop10",
    "vcrun2022",
    "vcrun2026",
    "d3dcompiler_42",
    "d3dcompiler_43",
    "d3dcompiler_46",
    "d3dcompiler_47",
    "gdiplus",
    "webview2",
    "corefonts",
    "allfonts",
    "andale",
    "baekmuk",
    "calibri",
    "cambria",
    "candara",
    "cjkfonts",
    "consolas",
    "constantia",
    "corbel",
    "droid",
    "eufonts",
    "fakechinese",
    "fakejapanese",
    "fakejapanese_ipamona",
    "fakejapanese_vlgothic",
    "fakekorean",
    "ipamona",
    "liberation",
    "lucida",
    "meiryo",
    "notosans",
    "opensymbol",
    "pptfonts",
    "segoeui-noto",
    "sourcehansans",
    "tahoma",
    "takao",
    "uff",
    "unifont",
    "vlgothic",
    "wenquanyi",
    "wenquanyizenhei"
  ]
}
